{
  "schema_version": "1.0.0",
  "artifact_id": "art_out_traceability_validator",
  "type": "validation-finding",
  "worker_id": "traceability-validator",
  "title": "traceability-validator output",
  "summary": "Verify every artifact traces to features, business rules, architecture, requirements, knowledge. Reject orphans. Never modify artifacts.",
  "entries": [
    {
      "id": "traceability-validator-feature-trace-01",
      "entry_kind": "feature-trace",
      "statement": "Sample finding `feature-trace` for traceability-validator.",
      "validation_id": "VAL-TV-feature-tr",
      "target": "ai-os/workers/",
      "rule": "feature-trace must satisfy Validation Engine contract",
      "result": "pass",
      "evidence": [
        "schemas/validation-engine-payload.schema.json",
        "workers/traceability-validator/"
      ],
      "severity": "info",
      "recommendation": "Do not mutate sources; remediate upstream packages if fail.",
      "confidence": 0.8,
      "source_paths": [
        "schemas/",
        "workers/",
        "pipelines/",
        "knowledge/",
        "templates/"
      ],
      "unknowns": [
        "UNKNOWN: none noted"
      ],
      "traceability": {
        "source_artifact": "schemas/",
        "knowledge": "knowledge/",
        "pipeline": "validation-engine",
        "worker": "traceability-validator"
      }
    },
    {
      "id": "traceability-validator-business-rule-trace-01",
      "entry_kind": "business-rule-trace",
      "statement": "Sample finding `business-rule-trace` for traceability-validator.",
      "validation_id": "VAL-TV-business-r",
      "target": "ai-os/workers/",
      "rule": "business-rule-trace must satisfy Validation Engine contract",
      "result": "pass",
      "evidence": [
        "schemas/validation-engine-payload.schema.json",
        "workers/traceability-validator/"
      ],
      "severity": "info",
      "recommendation": "Do not mutate sources; remediate upstream packages if fail.",
      "confidence": 0.8,
      "source_paths": [
        "schemas/",
        "workers/",
        "pipelines/",
        "knowledge/",
        "templates/"
      ],
      "unknowns": [
        "UNKNOWN: none noted"
      ],
      "traceability": {
        "source_artifact": "schemas/",
        "knowledge": "knowledge/",
        "pipeline": "validation-engine",
        "worker": "traceability-validator"
      }
    },
    {
      "id": "traceability-validator-architecture-trace-01",
      "entry_kind": "architecture-trace",
      "statement": "Sample finding `architecture-trace` for traceability-validator.",
      "validation_id": "VAL-TV-architectu",
      "target": "ai-os/workers/",
      "rule": "architecture-trace must satisfy Validation Engine contract",
      "result": "pass",
      "evidence": [
        "schemas/validation-engine-payload.schema.json",
        "workers/traceability-validator/"
      ],
      "severity": "info",
      "recommendation": "Do not mutate sources; remediate upstream packages if fail.",
      "confidence": 0.8,
      "source_paths": [
        "schemas/",
        "workers/",
        "pipelines/",
        "knowledge/",
        "templates/"
      ],
      "unknowns": [
        "UNKNOWN: none noted"
      ],
      "traceability": {
        "source_artifact": "schemas/",
        "knowledge": "knowledge/",
        "pipeline": "validation-engine",
        "worker": "traceability-validator"
      }
    }
  ],
  "status": "ready",
  "created_at": "2026-08-01T17:00:00Z",
  "trace": {
    "orchestration_id": "art_ve_orchestration",
    "plan_id": "art_ve_plan",
    "task_id": "art_task_traceability_validator",
    "run_id": "art_run_traceability_validator",
    "goal_id": "art_ve_goal"
  },
  "extensions": {
    "pipeline": "validation-engine",
    "mutate_source_artifacts": false,
    "invent_missing_information": false,
    "incremental": true,
    "partial": true
  }
}
