{
  "schema_version": "1.0.0",
  "artifact_id": "art_out_consistency_validator",
  "type": "validation-finding",
  "worker_id": "consistency-validator",
  "title": "consistency-validator output",
  "summary": "Detect contradictions, duplications, conflicting artifacts/requirements/architecture/business rules, naming inconsistencies.",
  "entries": [
    {
      "id": "consistency-validator-contradiction-01",
      "entry_kind": "contradiction",
      "statement": "Sample `contradiction` for consistency-validator.",
      "validation_id": "VAL-CV-contradictio",
      "target": "ai-os/workers/consistency-validator/",
      "rule": "contradiction per Validation Engine contract + RACI",
      "result": "pass",
      "evidence": [
        "core/packages/schemas/validation-engine-payload.schema.json",
        "core/packages/workers/consistency-validator/",
        "core/packages/pipelines/validation-engine/RACI.md"
      ],
      "severity": "info",
      "recommendation": "Do not mutate sources; remediate upstream packages if fail.",
      "confidence": 0.85,
      "source_paths": [
        "core/packages/schemas/",
        "core/packages/workers/",
        "core/packages/pipelines/",
        "core/packages/registry/",
        "core/packages/templates/"
      ],
      "unknowns": [
        "UNKNOWN: none noted"
      ],
      "traceability": {
        "source_artifact": "core/packages/workers/consistency-validator/",
        "knowledge": "artifacts/knowledge/",
        "pipeline": "validation-engine",
        "worker": "consistency-validator"
      },
      "folder_mirror": "artifacts/validation/consistency-validator/contradiction.json"
    },
    {
      "id": "consistency-validator-duplication-01",
      "entry_kind": "duplication",
      "statement": "Sample `duplication` for consistency-validator.",
      "validation_id": "VAL-CV-duplication",
      "target": "ai-os/workers/consistency-validator/",
      "rule": "duplication per Validation Engine contract + RACI",
      "result": "pass",
      "evidence": [
        "core/packages/schemas/validation-engine-payload.schema.json",
        "core/packages/workers/consistency-validator/",
        "core/packages/pipelines/validation-engine/RACI.md"
      ],
      "severity": "info",
      "recommendation": "Do not mutate sources; remediate upstream packages if fail.",
      "confidence": 0.85,
      "source_paths": [
        "core/packages/schemas/",
        "core/packages/workers/",
        "core/packages/pipelines/",
        "core/packages/registry/",
        "core/packages/templates/"
      ],
      "unknowns": [
        "UNKNOWN: none noted"
      ],
      "traceability": {
        "source_artifact": "core/packages/workers/consistency-validator/",
        "knowledge": "artifacts/knowledge/",
        "pipeline": "validation-engine",
        "worker": "consistency-validator"
      },
      "folder_mirror": "artifacts/validation/consistency-validator/duplication.json"
    },
    {
      "id": "consistency-validator-conflicting-requirement-01",
      "entry_kind": "conflicting-requirement",
      "statement": "Sample `conflicting-requirement` for consistency-validator.",
      "validation_id": "VAL-CV-conflicting-",
      "target": "ai-os/workers/consistency-validator/",
      "rule": "conflicting-requirement per Validation Engine contract + RACI",
      "result": "pass",
      "evidence": [
        "core/packages/schemas/validation-engine-payload.schema.json",
        "core/packages/workers/consistency-validator/",
        "core/packages/pipelines/validation-engine/RACI.md"
      ],
      "severity": "info",
      "recommendation": "Do not mutate sources; remediate upstream packages if fail.",
      "confidence": 0.85,
      "source_paths": [
        "core/packages/schemas/",
        "core/packages/workers/",
        "core/packages/pipelines/",
        "core/packages/registry/",
        "core/packages/templates/"
      ],
      "unknowns": [
        "UNKNOWN: none noted"
      ],
      "traceability": {
        "source_artifact": "core/packages/workers/consistency-validator/",
        "knowledge": "artifacts/knowledge/",
        "pipeline": "validation-engine",
        "worker": "consistency-validator"
      },
      "folder_mirror": "artifacts/validation/consistency-validator/conflicting-requirement.json"
    }
  ],
  "status": "ready",
  "created_at": "2026-08-01T18:00:00Z",
  "trace": {
    "orchestration_id": "art_ve_orchestration",
    "plan_id": "art_ve_plan",
    "task_id": "art_task_consistency_validator",
    "run_id": "art_run_consistency_validator",
    "goal_id": "art_ve_goal"
  },
  "extensions": {
    "pipeline": "validation-engine",
    "mutate_source_artifacts": false,
    "invent_missing_information": false,
    "incremental": true,
    "partial": true,
    "folder_partition": "artifacts/validation/consistency-validator/",
    "validation_scope": {
      "mode": "full",
      "note": "Sample is full-scope; scoped runs set paths here"
    }
  }
}
